{
  "artifact_kind": "industry_research_version",
  "change_reason": "承接R1主题基线并定义产业层瓶颈研究。",
  "change_summary": "建立产业层证据搜索与证伪设计。",
  "content_hash": "64fe9a5528462eb0767af3f0c92c895f600a7da05e058e9994c7697781b317c8",
  "created_at": "2026-07-18T00:00:00Z",
  "created_by": "Codex",
  "creation_stage": "research_design",
  "incorporated_event_ids": [],
  "parent_version_id": null,
  "project_id": "research_project:new_energy_storage_industry_bottleneck",
  "schema_version": "2.1.0",
  "semantic_version": "0.1.0",
  "snapshot": {
    "causal_edges": [
      {
        "boundary_condition": "比较相同应用场景和调度责任。",
        "causal_edge_id": "causal_edge:new_energy_storage_industry_bottleneck:duty_cycle_revenue_rule_to_delivered_efficiency_degradation_safety",
        "confidence": 0.35,
        "effect_polarity": "conditional",
        "feedback_loop_id": null,
        "from_causal_node_id": "causal_node:new_energy_storage_industry_bottleneck:duty_cycle_revenue_rule",
        "lifecycle_status": "active",
        "mechanism_text": "duty cycle和收益规则决定循环深度、时长、频率及可获得收入。",
        "provenance": {
          "actor_type": "codex",
          "agent_run_id": "research-project-v2-r1-pilots",
          "created_at": "2026-07-17T00:00:00Z",
          "created_by": "Codex",
          "created_in_version": "research_version:new_energy_storage_industry_bottleneck:0.1.0",
          "review_status": "pending_review"
        },
        "relation_type": "may_cause",
        "strength": 0.4,
        "supporting_claim_ids": [
          "claim:new_energy_storage_industry_bottleneck:primary"
        ],
        "time_lag": "one_project_design_cycle",
        "to_causal_node_id": "causal_node:new_energy_storage_industry_bottleneck:delivered_efficiency_degradation_safety",
        "validation_metric_ids": [
          "metric:new_energy_storage_industry_bottleneck:primary"
        ]
      },
      {
        "boundary_condition": "采用商业项目交付而非实验室单体指标。",
        "causal_edge_id": "causal_edge:new_energy_storage_industry_bottleneck:delivered_efficiency_degradation_safety_to_integration_om_financing",
        "confidence": 0.35,
        "effect_polarity": "conditional",
        "feedback_loop_id": null,
        "from_causal_node_id": "causal_node:new_energy_storage_industry_bottleneck:delivered_efficiency_degradation_safety",
        "lifecycle_status": "active",
        "mechanism_text": "实际循环工况映射到效率、退化、安全和可用率。",
        "provenance": {
          "actor_type": "codex",
          "agent_run_id": "research-project-v2-r1-pilots",
          "created_at": "2026-07-17T00:00:00Z",
          "created_by": "Codex",
          "created_in_version": "research_version:new_energy_storage_industry_bottleneck:0.1.0",
          "review_status": "pending_review"
        },
        "relation_type": "may_cause",
        "strength": 0.4,
        "supporting_claim_ids": [
          "claim:new_energy_storage_industry_bottleneck:primary"
        ],
        "time_lag": "first_operating_year",
        "to_causal_node_id": "causal_node:new_energy_storage_industry_bottleneck:integration_om_financing",
        "validation_metric_ids": [
          "metric:new_energy_storage_industry_bottleneck:primary"
        ]
      },
      {
        "boundary_condition": "EPC与O&M边界口径一致。",
        "causal_edge_id": "causal_edge:new_energy_storage_industry_bottleneck:integration_om_financing_to_site_grid_supply_constraint",
        "confidence": 0.35,
        "effect_polarity": "negative",
        "feedback_loop_id": null,
        "from_causal_node_id": "causal_node:new_energy_storage_industry_bottleneck:integration_om_financing",
        "lifecycle_status": "active",
        "mechanism_text": "交付性能决定集成冗余、运维准备和融资风险溢价。",
        "provenance": {
          "actor_type": "codex",
          "agent_run_id": "research-project-v2-r1-pilots",
          "created_at": "2026-07-17T00:00:00Z",
          "created_by": "Codex",
          "created_in_version": "research_version:new_energy_storage_industry_bottleneck:0.1.0",
          "review_status": "pending_review"
        },
        "relation_type": "may_cause",
        "strength": 0.4,
        "supporting_claim_ids": [
          "claim:new_energy_storage_industry_bottleneck:primary"
        ],
        "time_lag": "first_three_commercial_projects",
        "to_causal_node_id": "causal_node:new_energy_storage_industry_bottleneck:site_grid_supply_constraint",
        "validation_metric_ids": [
          "metric:new_energy_storage_industry_bottleneck:primary"
        ]
      },
      {
        "boundary_condition": "按同duty cycle与融资口径比较。",
        "causal_edge_id": "causal_edge:new_energy_storage_industry_bottleneck:site_grid_supply_constraint_to_route_adoption_economics",
        "confidence": 0.35,
        "effect_polarity": "conditional",
        "feedback_loop_id": null,
        "from_causal_node_id": "causal_node:new_energy_storage_industry_bottleneck:site_grid_supply_constraint",
        "lifecycle_status": "active",
        "mechanism_text": "场站、电网、消防与供应链约束共同决定路线采用和最终LCOS。",
        "provenance": {
          "actor_type": "codex",
          "agent_run_id": "research-project-v2-r1-pilots",
          "created_at": "2026-07-17T00:00:00Z",
          "created_by": "Codex",
          "created_in_version": "research_version:new_energy_storage_industry_bottleneck:0.1.0",
          "review_status": "pending_review"
        },
        "relation_type": "may_cause",
        "strength": 0.4,
        "supporting_claim_ids": [
          "claim:new_energy_storage_industry_bottleneck:primary"
        ],
        "time_lag": "three_commercial_projects",
        "to_causal_node_id": "causal_node:new_energy_storage_industry_bottleneck:route_adoption_economics",
        "validation_metric_ids": [
          "metric:new_energy_storage_industry_bottleneck:primary"
        ]
      }
    ],
    "causal_nodes": [
      {
        "causal_node_id": "causal_node:new_energy_storage_industry_bottleneck:duty_cycle_revenue_rule",
        "lifecycle_status": "active",
        "node_kind": "trigger",
        "node_text": "目标duty cycle、调度方式与项目收益规则",
        "provenance": {
          "actor_type": "codex",
          "agent_run_id": "research-project-v2-r1-pilots",
          "created_at": "2026-07-17T00:00:00Z",
          "created_by": "Codex",
          "created_in_version": "research_version:new_energy_storage_industry_bottleneck:0.1.0",
          "review_status": "pending_review"
        }
      },
      {
        "causal_node_id": "causal_node:new_energy_storage_industry_bottleneck:delivered_efficiency_degradation_safety",
        "lifecycle_status": "active",
        "node_kind": "system_parameter",
        "node_text": "交付效率、寿命退化、安全事件与系统availability",
        "provenance": {
          "actor_type": "codex",
          "agent_run_id": "research-project-v2-r1-pilots",
          "created_at": "2026-07-17T00:00:00Z",
          "created_by": "Codex",
          "created_in_version": "research_version:new_energy_storage_industry_bottleneck:0.1.0",
          "review_status": "pending_review"
        }
      },
      {
        "causal_node_id": "causal_node:new_energy_storage_industry_bottleneck:integration_om_financing",
        "lifecycle_status": "active",
        "node_kind": "mechanism",
        "node_text": "系统集成、EPC、O&M与融资成本共同形成delivered LCOS",
        "provenance": {
          "actor_type": "codex",
          "agent_run_id": "research-project-v2-r1-pilots",
          "created_at": "2026-07-17T00:00:00Z",
          "created_by": "Codex",
          "created_in_version": "research_version:new_energy_storage_industry_bottleneck:0.1.0",
          "review_status": "pending_review"
        }
      },
      {
        "causal_node_id": "causal_node:new_energy_storage_industry_bottleneck:site_grid_supply_constraint",
        "lifecycle_status": "active",
        "node_kind": "constraint",
        "node_text": "场站条件、电网接入、消防审批与供应链交付约束",
        "provenance": {
          "actor_type": "codex",
          "agent_run_id": "research-project-v2-r1-pilots",
          "created_at": "2026-07-17T00:00:00Z",
          "created_by": "Codex",
          "created_in_version": "research_version:new_energy_storage_industry_bottleneck:0.1.0",
          "review_status": "pending_review"
        }
      },
      {
        "causal_node_id": "causal_node:new_energy_storage_industry_bottleneck:route_adoption_economics",
        "lifecycle_status": "active",
        "node_kind": "outcome",
        "node_text": "同场景路线采用、项目经济性与回款结果",
        "provenance": {
          "actor_type": "codex",
          "agent_run_id": "research-project-v2-r1-pilots",
          "created_at": "2026-07-17T00:00:00Z",
          "created_by": "Codex",
          "created_in_version": "research_version:new_energy_storage_industry_bottleneck:0.1.0",
          "review_status": "pending_review"
        }
      }
    ],
    "claim_relations": [
      {
        "created_in_version": "research_version:new_energy_storage_industry_bottleneck:0.1.0",
        "from_claim_id": "claim:new_energy_storage_industry_bottleneck:counter",
        "provenance": {
          "actor_type": "codex",
          "agent_run_id": "research-project-v2-r1-pilots",
          "created_at": "2026-07-17T00:00:00Z",
          "created_by": "Codex",
          "created_in_version": "research_version:new_energy_storage_industry_bottleneck:0.1.0",
          "review_status": "pending_review"
        },
        "relation_id": "claim_relation:new_energy_storage_industry_bottleneck:counter",
        "relation_summary": "替代解释挑战主假设。",
        "relation_type": "challenges",
        "to_claim_id": "claim:new_energy_storage_industry_bottleneck:primary"
      }
    ],
    "claims": [
      {
        "claim_id": "claim:new_energy_storage_industry_bottleneck:primary",
        "claim_kind": "primary",
        "claim_status": "hypothesis",
        "claim_text": "路线胜负可能由交付LCOS、安全、寿命、制造与系统集成及场景适配共同决定，而非单体指标，尚待验证。",
        "confidence": 0.38,
        "context_reference_ids": [